{
  "schema_version": "ccc-native-canary-result-v1",
  "scenario_id": "solo-guard",
  "fixture_sha256": "7a1914fd430732f3ba0aae49d3e56105d625a292c396f42e9c7ec0c5f37e39da",
  "route": "solo",
  "expected_child_count": 0,
  "observed_child_count": 0,
  "children_distinct": null,
  "worktree_unchanged": true,
  "requested_model": null,
  "resolved_model": null,
  "requested_effort": null,
  "resolved_effort": null,
  "fallback": "none",
  "failure_class": "none",
  "verification": "NOT_VERIFIED",
  "task_result": "PASS",
  "wall_time_ms": 0,
  "parent_rework": "none"
}
