{
  "schema_version": "ccc-native-canary-result-v1",
  "scenario_id": "parallel-read",
  "fixture_sha256": "8079ac9fe151c8631c807170b0b29e4617ef2b466f0ef5758772ce58628cf270",
  "route": "parallel-read",
  "expected_child_count": 2,
  "observed_child_count": 2,
  "children_distinct": true,
  "worktree_unchanged": true,
  "requested_model": "gpt-5.3-codex-spark",
  "resolved_model": "gpt-5.6-luna",
  "requested_effort": "low",
  "resolved_effort": "low",
  "fallback": "spark_to_luna",
  "failure_class": "quota_denied",
  "verification": "VERIFIED",
  "task_result": "PASS",
  "wall_time_ms": 55843,
  "parent_rework": "none"
}
