{
  "schema_version": "ccc-native-canary-result-v1",
  "scenario_id": "host-default-judgment",
  "fixture_sha256": "b9f7ce32b3cad860a20ebccb447f7db4d503316d275dc6f10e212ee76956c8b5",
  "route": "standard",
  "expected_child_count": 1,
  "observed_child_count": 1,
  "children_distinct": null,
  "worktree_unchanged": true,
  "requested_model": "host-default",
  "resolved_model": "gpt-5.6-sol",
  "requested_effort": "host-default",
  "resolved_effort": "xhigh",
  "fallback": "none",
  "failure_class": "none",
  "verification": "VERIFIED",
  "task_result": "PASS",
  "wall_time_ms": 28611,
  "parent_rework": "none"
}
