{
  "schema_version": "ccc-native-canary-result-v1",
  "scenario_id": "frontier-seeded-defect-review",
  "fixture_sha256": "4d2a3b211a2884f8745738f4f92a2453393edcd302f188b04274cd6708ee63a8",
  "route": "frontier",
  "expected_child_count": 1,
  "observed_child_count": 1,
  "children_distinct": null,
  "worktree_unchanged": true,
  "requested_model": "gpt-5.6-sol",
  "resolved_model": "gpt-5.6-sol",
  "requested_effort": "high",
  "resolved_effort": "high",
  "fallback": "none",
  "failure_class": "none",
  "verification": "VERIFIED",
  "task_result": "PASS",
  "wall_time_ms": 24193,
  "parent_rework": "none"
}
